Title,Description,URL,Label,Processed_Description,Stemmed,Lemmatized
Wyndham Gains From Infrastructure Boom With Record Pipeline,"The hotel industry is having its own AI moment, helping to house all the construction workers building the needed data centers.
 -Sean O'Neill",http://skift.com/2025/02/13/wyndham-gains-from-infrastructure-boom-with-record-pipeline/,Unknown,"the hotel industry is having its own ai moment, helping to house all the construction workers building the needed data centers.
 -sean o'neill","the hotel industry be have its own ai moment , help to house all the construction worker build the need data center . 
  -sean o'neill","the hotel industry be have its own ai moment , help to house all the construction worker build the need data center . 
  -sean o'neill"
Closing The Leadership Development Gap,"Leading others is not always easy, and using a strong sense of self to inform your efforts can make the experience quite rewarding.",https://www.forbes.com/councils/forbesbusinesscouncil/2025/02/13/closing-the-leadership-development-gap/,Unknown,"leading others is not always easy, and using a strong sense of self to inform your efforts can make the experience quite rewarding.","lead other be not always easy , and use a strong sense of self to inform your effort can make the experience quite rewarding .","lead other be not always easy , and use a strong sense of self to inform your effort can make the experience quite rewarding ."
Reaping Asia’s Silver Demographic Dividend,"Asia’s population is aging rapidly, with significant economic consequences. But by adopting policies that keep older individuals in the workforce and boost their productivity and well-being, the region’s governments can transform the challenges of a graying s…",https://www.project-syndicate.org/commentary/asian-governments-must-boost-productivity-and-health-of-older-workers-by-lee-jong-wha-2025-02,Unknown,"asia’s population is aging rapidly, with significant economic consequences. but by adopting policies that keep older individuals in the workforce and boost their productivity and well-being, the region’s governments can transform the challenges of a graying s…","asia ’s population be age rapidly , with significant economic consequence . but by adopt policy that keep old individual in the workforce and boost their productivity and well - being , the region ’s government can transform the challenge of a gray s …","asia ’s population be age rapidly , with significant economic consequence . but by adopt policy that keep old individual in the workforce and boost their productivity and well - being , the region ’s government can transform the challenge of a gray s …"
Gurobi AI Modeling Empowers Users with Accessible Optimization Resources,"New resources and AI-powered tools simplify the transition from real-world problems to mathematical models. BEAVERTON, Ore. — Gurobi Optimization, LLC, the leader in decision intelligence technology, is pleased to announce the launch of Gurobi AI Modeling, a …",https://financialpost.com/pmn/business-wire-news-releases-pmn/gurobi-ai-modeling-empowers-users-with-accessible-optimization-resources,Unknown,"new resources and ai-powered tools simplify the transition from real-world problems to mathematical models. beaverton, ore. — gurobi optimization, llc, the leader in decision intelligence technology, is pleased to announce the launch of gurobi ai modeling, a …","new resource and ai - power tool simplify the transition from real - world problem to mathematical model . beaverton , ore . — gurobi optimization , llc , the leader in decision intelligence technology , be pleased to announce the launch of gurobi ai modeling , a …","new resource and ai - power tool simplify the transition from real - world problem to mathematical model . beaverton , ore . — gurobi optimization , llc , the leader in decision intelligence technology , be pleased to announce the launch of gurobi ai modeling , a …"
AI automation may enable 10% of sales associates to hold multiple jobs by 2028,"By 2028, AI is expected to allow 10% of sales associates to take on multiple jobs undetected by their employers, according to Gartner.",https://www.techmonitor.ai/ai-and-automation/ai-automation-enable-10-sales-associates-hold-multiple-jobs-2028/,Unknown,"by 2028, ai is expected to allow 10% of sales associates to take on multiple jobs undetected by their employers, according to gartner.","by 2028 , ai be expect to allow 10 % of sale associate to take on multiple job undetecte by their employer , accord to gartner .","by 2028 , ai be expect to allow 10 % of sale associate to take on multiple job undetecte by their employer , accord to gartner ."
"Schwab, Georgieva Discuss ‘New Era’ of Global Transformations at World Governments Summit in Dubai","Government and corporate leaders gather at Dubai’s World Governments Summit to chart an innovative roadmap for global governance, focusing on solutions in healthcare, education, technology, international trade, and mobility. DUBAI, United Arab Emirates — The …",https://financialpost.com/pmn/business-wire-news-releases-pmn/schwab-georgieva-discuss-new-era-of-global-transformations-at-world-governments-summit-in-dubai-2,Unknown,"government and corporate leaders gather at dubai’s world governments summit to chart an innovative roadmap for global governance, focusing on solutions in healthcare, education, technology, international trade, and mobility. dubai, united arab emirates — the …","government and corporate leader gather at dubai ’s world government summit to chart an innovative roadmap for global governance , focus on solution in healthcare , education , technology , international trade , and mobility . dubai , united arab emirates — the …","government and corporate leader gather at dubai ’s world government summit to chart an innovative roadmap for global governance , focus on solution in healthcare , education , technology , international trade , and mobility . dubai , united arab emirates — the …"
"Nothing Phone 3a Series Confirmed to Use a Snapdragon Chipset, Get Faster AI Processing","Nothing Phone 3a Series is set to be launched on March 4. Ahead of the launch, the company has shared key information about the upcoming smartphones. Nothing CEO Carl Pei revealed that the handsets will be equipped with a Snapdragon chipset. In comparison, it…",https://www.gadgets360.com/mobiles/news/nothing-phone-3a-snapdragon-chipset-confirmed-carl-pei-npu-cpu-improvements-7702844,Unknown,"nothing phone 3a series is set to be launched on march 4. ahead of the launch, the company has shared key information about the upcoming smartphones. nothing ceo carl pei revealed that the handsets will be equipped with a snapdragon chipset. in comparison, it…","nothing phone 3a series be set to be launch on march 4 . ahead of the launch , the company have share key information about the upcoming smartphone . nothing ceo carl pei reveal that the handset will be equip with a snapdragon chipset . in comparison , it …","nothing phone 3a series be set to be launch on march 4 . ahead of the launch , the company have share key information about the upcoming smartphone . nothing ceo carl pei reveal that the handset will be equip with a snapdragon chipset . in comparison , it …"
IBM under fire as return-to-office order suspected of replacing human staff with AI,Voluntary layoffs induced by IBM’s return-to-office mandate could see the company employ more AI.,https://www.techradar.com/pro/ibm-return-to-office-order-hits-finance-ops-teams-amid-push-to-dump-staff-for-ai,Unknown,voluntary layoffs induced by ibm’s return-to-office mandate could see the company employ more ai.,voluntary layoff induce by ibm ’s return - to - office mandate could see the company employ more ai .,voluntary layoff induce by ibm ’s return - to - office mandate could see the company employ more ai .
How To Address Skills Gaps In 2025: Part 1,"This year, skills data is going to be leveraged across the enterprise. Deploying “skills intelligence” will underpin decision-making far beyond L&D.",https://www.forbes.com/councils/forbeshumanresourcescouncil/2025/02/13/how-to-address-skills-gaps-in-2025-part-1/,Unknown,"this year, skills data is going to be leveraged across the enterprise. deploying “skills intelligence” will underpin decision-making far beyond l&d.","this year , skill datum be go to be leverage across the enterprise . deploy "" skill intelligence "" will underpin decision - make far beyond l&d .","this year , skill datum be go to be leverage across the enterprise . deploy "" skill intelligence "" will underpin decision - make far beyond l&d ."
Unicorn Co-Founder Mark Wendou Niu Joins YY Group as Chief Strategist Officer,"Singapore, Feb. 13, 2025 (GLOBE NEWSWIRE) -- YY Group Holding Limited (NASDAQ: YYGH) (“YY Group”, “YYGH”, or the “Company”) is pleased to announce the appointment of Mark Wendou Niu as Group Chief Strategy Officer. In this strategic role, Mark will lead YY Gr…",https://www.globenewswire.com/news-release/2025/02/13/3025790/0/en/Unicorn-Co-Founder-Mark-Wendou-Niu-Joins-YY-Group-as-Chief-Strategist-Officer.html,Unknown,"singapore, feb. 13, 2025 (globe newswire) -- yy group holding limited (nasdaq: yygh) (“yy group”, “yygh”, or the “company”) is pleased to announce the appointment of mark wendou niu as group chief strategy officer. in this strategic role, mark will lead yy gr…","singapore , feb . 13 , 2025 ( globe newswire ) -- yy group holding limited ( nasdaq : yygh ) ( "" yy group "" , "" yygh "" , or the "" company "" ) be pleased to announce the appointment of mark wendou niu as group chief strategy officer . in this strategic role , mark will lead yy gr …","singapore , feb . 13 , 2025 ( globe newswire ) -- yy group holding limited ( nasdaq : yygh ) ( "" yy group "" , "" yygh "" , or the "" company "" ) be pleased to announce the appointment of mark wendou niu as group chief strategy officer . in this strategic role , mark will lead yy gr …"
Filling The L&D Gap With Extra Hands: Staff Augmentation,"Learn how staff augmentation fills the L&D gap by adding skilled experts to your team, boosting efficiency, and driving learning innovation.
This post was first published on eLearning Industry.",https://elearningindustry.com/filling-the-ld-gap-with-extra-hands-staff-augmentation,Unknown,"learn how staff augmentation fills the l&d gap by adding skilled experts to your team, boosting efficiency, and driving learning innovation.
this post was first published on elearning industry.","learn how staff augmentation fill the l&d gap by add skilled expert to your team , boost efficiency , and drive learn innovation . 
 this post be first publish on elearne industry .","learn how staff augmentation fill the l&d gap by add skilled expert to your team , boost efficiency , and drive learn innovation . 
 this post be first publish on elearne industry ."
"63% of companies in India’s power sector forecast hiring growth, reveals TeamLease Survey for H2FY25","Driven by the demand for renewable energy and grid modernisation, 63% of India's power and energy sector companies are planning to expand their workforce. Significant investment and ambitious targets are creating a need for skilled professionals in engineerin…",https://economictimes.indiatimes.com/jobs/hr-policies-trends/63-of-companies-in-indias-power-sector-forecast-hiring-growth-reveals-teamlease-survey-for-h2fy25/articleshow/118215148.cms,Unknown,"driven by the demand for renewable energy and grid modernisation, 63% of india's power and energy sector companies are planning to expand their workforce. significant investment and ambitious targets are creating a need for skilled professionals in engineerin…","drive by the demand for renewable energy and grid modernisation , 63 % of india 's power and energy sector company be plan to expand their workforce . significant investment and ambitious target be create a need for skilled professional in engineerin …","drive by the demand for renewable energy and grid modernisation , 63 % of india 's power and energy sector company be plan to expand their workforce . significant investment and ambitious target be create a need for skilled professional in engineerin …"
"TELUS Digital reports fourth quarter and full-year 2024 results, delivering stable operating and financial performance; provides outlook for 2025","VANCOUVER, British Columbia — TELUS Digital Experience (TELUS Digital) (NYSE and TSX: TIXT), a company dedicated to crafting lasting customer experiences through data, technology, and a human-centric approach, today released its results for the fourth quarter…",https://financialpost.com/pmn/business-wire-news-releases-pmn/telus-digital-reports-fourth-quarter-and-full-year-2024-results-delivering-stable-operating-and-financial-performance-provides-outlook-for-2025,Unknown,"vancouver, british columbia — telus digital experience (telus digital) (nyse and tsx: tixt), a company dedicated to crafting lasting customer experiences through data, technology, and a human-centric approach, today released its results for the fourth quarter…","vancouver , british columbia — telus digital experience ( telus digital ) ( nyse and tsx : tixt ) , a company dedicate to craft last customer experience through datum , technology , and a human - centric approach , today release its result for the fourth quarter …","vancouver , british columbia — telus digital experience ( telus digital ) ( nyse and tsx : tixt ) , a company dedicate to craft last customer experience through datum , technology , and a human - centric approach , today release its result for the fourth quarter …"
"Hydrophobic Interaction Chromatography Market to Reach $952.9 million, Globally, by 2033 at 7.5% CAGR: Allied Market Research","Increase in R&D expenditure in biopharmaceuticals, rise in demand for biologics and monoclonal antibodies (mAbs), and rise in adoption of biosimilars are the major factors that drive the growth of the hydrophobic interaction chromatography market. Increase in…",https://www.globenewswire.com/news-release/2025/02/13/3025716/0/en/Hydrophobic-Interaction-Chromatography-Market-to-Reach-952-9-million-Globally-by-2033-at-7-5-CAGR-Allied-Market-Research.html,Unknown,"increase in r&d expenditure in biopharmaceuticals, rise in demand for biologics and monoclonal antibodies (mabs), and rise in adoption of biosimilars are the major factors that drive the growth of the hydrophobic interaction chromatography market. increase in…","increase in r&d expenditure in biopharmaceutical , rise in demand for biologic and monoclonal antibody ( mab ) , and rise in adoption of biosimilar be the major factor that drive the growth of the hydrophobic interaction chromatography market . increase in …","increase in r&d expenditure in biopharmaceutical , rise in demand for biologic and monoclonal antibody ( mab ) , and rise in adoption of biosimilar be the major factor that drive the growth of the hydrophobic interaction chromatography market . increase in …"
Innovation in AI is in danger of outpacing governance,"Fast AI innovation comes at the expense of governance, with many leaders worried about a lack of AI frameworks.",https://www.techradar.com/pro/innovation-in-ai-is-in-danger-of-outpacing-governance,Unknown,"fast ai innovation comes at the expense of governance, with many leaders worried about a lack of ai frameworks.","fast ai innovation come at the expense of governance , with many leader worry about a lack of ai framework .","fast ai innovation come at the expense of governance , with many leader worry about a lack of ai framework ."
How AI Coding Models Are Redefining Software Development in 2025,"Imagine a world where your toughest problems are solved before you even have time to stress over them. From writing flawless code to managing complex logistics, artificial intelligence (AI) is rapidly evolving into a force capable of reshaping how we live, wo…",https://www.geeky-gadgets.com/ai-software-development-2025/,Unknown,"imagine a world where your toughest problems are solved before you even have time to stress over them. from writing flawless code to managing complex logistics, artificial intelligence (ai) is rapidly evolving into a force capable of reshaping how we live, wo…","imagine a world where your tough problem be solve before you even have time to stress over they . from write flawless code to manage complex logistic , artificial intelligence ( ai ) be rapidly evolve into a force capable of reshape how we live , will …","imagine a world where your tough problem be solve before you even have time to stress over they . from write flawless code to manage complex logistic , artificial intelligence ( ai ) be rapidly evolve into a force capable of reshape how we live , will …"
The End of Email? Workplace Communication Trends for 2025,Is email going away or becoming less important? Check out the workplace communication trends of the future below.,https://www.webpronews.com/workplace-communication-trends/,Unknown,is email going away or becoming less important? check out the workplace communication trends of the future below.,be email go away or become less important ? check out the workplace communication trend of the future below .,be email go away or become less important ? check out the workplace communication trend of the future below .
High-Tech Capitalism and Neo-Feudalism,"This oligarchy/plutocracy constitutes 0.1% of the American population. It owns 14% of the nation’s wealth, $22 trillion in stocks, bonds and real estate, while 50% of Americans own 2.4% of the national wealth ($4 trillion). These ultra rich individuals contri…",https://www.counterpunch.org/2025/02/13/high-tech-capitalism-and-neo-feudalism/,Unknown,"this oligarchy/plutocracy constitutes 0.1% of the american population. it owns 14% of the nation’s wealth, $22 trillion in stocks, bonds and real estate, while 50% of americans own 2.4% of the national wealth ($4 trillion). these ultra rich individuals contri…","this oligarchy / plutocracy constitute 0.1 % of the american population . it own 14 % of the nation ’s wealth , $ 22 trillion in stock , bond and real estate , while 50 % of americans own 2.4 % of the national wealth ( $ 4 trillion ) . these ultra rich individual contri …","this oligarchy / plutocracy constitute 0.1 % of the american population . it own 14 % of the nation ’s wealth , $ 22 trillion in stock , bond and real estate , while 50 % of americans own 2.4 % of the national wealth ( $ 4 trillion ) . these ultra rich individual contri …"
Musk says his new AI chatbot outperforms all rivals,"<p>DUBAI - Elon Musk says that his AI chatbot, and ChatGPT challenger, Grok 3, is in the final stages of development and will be released in a week or two.</p>",https://www.bangkokpost.com/life/tech/2960343/musk-says-his-new-ai-chatbot-outperforms-all-rivals,Unknown,"<p>dubai - elon musk says that his ai chatbot, and chatgpt challenger, grok 3, is in the final stages of development and will be released in a week or two.</p>","< p > dubai - elon musk say that his ai chatbot , and chatgpt challenger , grok 3 , be in the final stage of development and will be release in a week or two.</p >","< p > dubai - elon musk say that his ai chatbot , and chatgpt challenger , grok 3 , be in the final stage of development and will be release in a week or two.</p >"
"Elon Musk says Grok 3 in final stages, outperforming all chatbots","DUBAI : Elon Musk said on Thursday his AI chatbot, and ChatGPT challenger, Grok 3, is in the final stages of development and will be released in about a week or two.""Grok 3 has very powerful reasoning capabilities, so in the tests that we've done thus far, Gr…",https://www.channelnewsasia.com/business/elon-musk-says-grok-3-final-stages-outperforming-all-chatbots-4935571,Unknown,"dubai : elon musk said on thursday his ai chatbot, and chatgpt challenger, grok 3, is in the final stages of development and will be released in about a week or two.""grok 3 has very powerful reasoning capabilities, so in the tests that we've done thus far, gr…","dubai : elon musk say on thursday his ai chatbot , and chatgpt challenger , grok 3 , be in the final stage of development and will be release in about a week or two . ""grok 3 have very powerful reasoning capability , so in the test that we have do thus far , gr …","dubai : elon musk say on thursday his ai chatbot , and chatgpt challenger , grok 3 , be in the final stage of development and will be release in about a week or two . ""grok 3 have very powerful reasoning capability , so in the test that we have do thus far , gr …"
"Elon Musk says Grok 3 in final stages, outperforming all chatbots","Elon Musk said on Thursday his AI chatbot, and ChatGPT challenger, Grok 3, is in the final stages of development and will be released in about a week or two....",https://finance.yahoo.com/news/elon-musk-says-grok-3-064145297.html,Unknown,"elon musk said on thursday his ai chatbot, and chatgpt challenger, grok 3, is in the final stages of development and will be released in about a week or two....","elon musk say on thursday his ai chatbot , and chatgpt challenger , grok 3 , be in the final stage of development and will be release in about a week or two ....","elon musk say on thursday his ai chatbot , and chatgpt challenger , grok 3 , be in the final stage of development and will be release in about a week or two ...."
"About 75,000 US federal workers accept Trump administration buyout program","Around 75,000 U.S. federal workers have opted for the Trump administration's deferred buyout program aimed at reducing the civilian workforce. This move is part of a larger plan to cut government jobs and save $1 trillion, with Elon Musk spearheading the Depa…",https://economictimes.indiatimes.com/news/international/global-trends/about-75000-us-federal-workers-accept-trump-administration-buyout-program/articleshow/118198696.cms,Unknown,"around 75,000 u.s. federal workers have opted for the trump administration's deferred buyout program aimed at reducing the civilian workforce. this move is part of a larger plan to cut government jobs and save $1 trillion, with elon musk spearheading the depa…","around 75,000 u.s . federal worker have opt for the trump administration 's deferred buyout program aim at reduce the civilian workforce . this move be part of a large plan to cut government job and save $ 1 trillion , with elon musk spearhead the depa …","around 75,000 u.s . federal worker have opt for the trump administration 's deferred buyout program aim at reduce the civilian workforce . this move be part of a large plan to cut government job and save $ 1 trillion , with elon musk spearhead the depa …"
"Share Market Highlights 13 February 2025: Sensex, Nifty end lower as investors turn cautious ahead of Trump-Modi meeting","Sensex, Nifty updates on 13 February 2025: Benchmark indices Sensex and Nifty pared early gains to close lower for the seventh straight day on Thursday, dragged by fag-end selling in select IT and banking shares and foreign fund outflows. The 30-share BSE Sen…",https://www.thehindubusinessline.com/markets/share-market-highlights-13-february-2025/article69211647.ece,Unknown,"sensex, nifty updates on 13 february 2025: benchmark indices sensex and nifty pared early gains to close lower for the seventh straight day on thursday, dragged by fag-end selling in select it and banking shares and foreign fund outflows. the 30-share bse sen…","sensex , nifty update on 13 february 2025 : benchmark index sensex and nifty pare early gain to close low for the seventh straight day on thursday , drag by fag - end selling in select it and banking share and foreign fund outflow . the 30 - share bse sen …","sensex , nifty update on 13 february 2025 : benchmark index sensex and nifty pare early gain to close low for the seventh straight day on thursday , drag by fag - end selling in select it and banking share and foreign fund outflow . the 30 - share bse sen …"
Direxion Launches 2 Leveraged AMD ETFs Amid AI Chip Race,"AMD joins Direxion's semiconductor single-stock ETF lineup as the chipmaker doubles down on AI and data center growth, with new bull and bear funds.",http://www.etf.com/sections/news/direxion-launches-2-leveraged-amd-etfs-amid-ai-chip-race-0?utm_source=yahoo-finance&amp;utm_medium=rss&amp;utm_campaign=yahoo-finance-rss,Unknown,"amd joins direxion's semiconductor single-stock etf lineup as the chipmaker doubles down on ai and data center growth, with new bull and bear funds.","amd join direxion 's semiconductor single - stock etf lineup as the chipmaker double down on ai and datum center growth , with new bull and bear fund .","amd join direxion 's semiconductor single - stock etf lineup as the chipmaker double down on ai and datum center growth , with new bull and bear fund ."
