Title,Description,URL,Label,Processed_Description,Stemmed,Lemmatized
"Amazon Robotics chief technologist discusses AI, warehouse jobs, and how human 'common sense' will always be needed","In a wide-ranging interview with BI, Tye Brady explains why the company is investing heavily in robots.",https://www.businessinsider.com/amazon-robotics-tye-brady-ai-warehouse-jobs-human-common-sense-2025-2,Unknown,"in a wide-ranging interview with bi, tye brady explains why the company is investing heavily in robots.","in a wide - range interview with bi , tye brady explain why the company be invest heavily in robot .","in a wide - range interview with bi , tye brady explain why the company be invest heavily in robot ."
"Nearly half of bosses worldwide have plans to fire and replace you with AI in the next 5 years, World Economic Forum warns—these jobs are most at risk",You’re even more likely to lose your job to a tech savvy worker: A staggering 70% of bosses surveyed plan to hire staff with AI skills.,https://finance.yahoo.com/news/world-economic-forum-says-41-110400834.html,Unknown,you’re even more likely to lose your job to a tech savvy worker: a staggering 70% of bosses surveyed plan to hire staff with ai skills.,you ’re even more likely to lose your job to a tech savvy worker : a staggering 70 % of boss survey plan to hire staff with ai skill .,you ’re even more likely to lose your job to a tech savvy worker : a staggering 70 % of boss survey plan to hire staff with ai skill .
Why AI Usage May Degrade Human Cognition and Blunt Critical Thinking Skills,Any statement regarding the potential benefits and/or hazards of AI tends to be automatically very divisive and controversial as the world tries to figure out what the technology means to …read more,https://hackaday.com/2025/02/13/why-ai-usage-may-degrade-human-cognition-and-blunt-critical-thinking-skills/,Unknown,any statement regarding the potential benefits and/or hazards of ai tends to be automatically very divisive and controversial as the world tries to figure out what the technology means to …read more,any statement regard the potential benefit and/or hazard of ai tend to be automatically very divisive and controversial as the world try to figure out what the technology mean to … read more,any statement regard the potential benefit and/or hazard of ai tend to be automatically very divisive and controversial as the world try to figure out what the technology mean to … read more
5 economic papers that lit up our brains — and what they say about our confusing world,"We at Planet Money are constantly reading the work of economists and other social scientists to glean ideas, evidence and insights about the economy, and, more generally, the confusing world around us. Welcome to the inaugural installment of the Planet Money …",https://www.npr.org/2025/01/28/g-s1-45056/economy-money-papers-explained,Unknown,"we at planet money are constantly reading the work of economists and other social scientists to glean ideas, evidence and insights about the economy, and, more generally, the confusing world around us. welcome to the inaugural installment of the planet money …","we at planet money be constantly read the work of economist and other social scientist to glean idea , evidence and insight about the economy , and , more generally , the confusing world around we . welcome to the inaugural installment of the planet money …","we at planet money be constantly read the work of economist and other social scientist to glean idea , evidence and insight about the economy , and , more generally , the confusing world around we . welcome to the inaugural installment of the planet money …"
Google employees respond after company drops its promise on AI weapons: 'Are we the baddies?',"After Google scrubbed wording that promised not to use AI for weapons, some staff slammed the decision in the company's internal message board.",https://www.businessinsider.com/google-employees-slam-company-after-it-ditches-ai-weapons-pledge-2025-2,Unknown,"after google scrubbed wording that promised not to use ai for weapons, some staff slammed the decision in the company's internal message board.","after google scrub wording that promise not to use ai for weapon , some staff slam the decision in the company 's internal message board .","after google scrub wording that promise not to use ai for weapon , some staff slam the decision in the company 's internal message board ."
MBA grads are struggling to find work amid a white-collar hiring slowdown,Recent MBA graduates from schools like Harvard and Yale are taking longer to find work due to a hiring slowdown for some white-collar roles.,https://www.businessinsider.com/mba-graduates-cant-find-jobs-white-collar-hiring-slowdown-2025-2,Unknown,recent mba graduates from schools like harvard and yale are taking longer to find work due to a hiring slowdown for some white-collar roles.,recent mba graduate from school like harvard and yale be take long to find work due to a hire slowdown for some white - collar role .,recent mba graduate from school like harvard and yale be take long to find work due to a hire slowdown for some white - collar role .
AI execs at big consulting firms share their favorite prompts and how they use the technology,"AI chiefs at top consultancies, including PwC, McKinsey, and Deloitte, told Business Insider how they use AI for their professional and personal lives.",https://www.businessinsider.com/ai-chiefs-top-consulting-firms-how-to-use-ai-prompts-2025-2,Unknown,"ai chiefs at top consultancies, including pwc, mckinsey, and deloitte, told business insider how they use ai for their professional and personal lives.","ai chief at top consultancy , include pwc , mckinsey , and deloitte , tell business insider how they use ai for their professional and personal life .","ai chief at top consultancy , include pwc , mckinsey , and deloitte , tell business insider how they use ai for their professional and personal life ."
Tech companies laying off staff are still hiring — especially in AI,"As layoffs continue to sweep across tech companies, firms continue to hire. Some even plan to grow their head count this year.",https://www.businessinsider.com/tech-companies-hiring-job-openings-ai-cloud-infrastructure-layoffs-2025-2,Unknown,"as layoffs continue to sweep across tech companies, firms continue to hire. some even plan to grow their head count this year.","as layoff continue to sweep across tech company , firm continue to hire . some even plan to grow their head count this year .","as layoff continue to sweep across tech company , firm continue to hire . some even plan to grow their head count this year ."
Tech layoffs reveal the unintended consequences of mass job cuts,"For decades, Daelynn Moyer easily secured job offers in the tech industry, working her way up from a computer maintenance technician to a manager leading...",https://washingtonpost.com/technology/2025/02/10/tech-layoffs-workers-meta-microsoft-workday/,Unknown,"for decades, daelynn moyer easily secured job offers in the tech industry, working her way up from a computer maintenance technician to a manager leading...","for decade , daelynn moyer easily secure job offer in the tech industry , work her way up from a computer maintenance technician to a manager lead ...","for decade , daelynn moyer easily secure job offer in the tech industry , work her way up from a computer maintenance technician to a manager lead ..."
Marc Benioff says that from now on CEOs will no longer lead all-human workforces—enter the new era of AI coworkers,"The AI agents are here—and they’re taking over more work at the office, reigniting employees' worst fears.",https://finance.yahoo.com/news/marc-benioff-says-now-ceos-181929606.html,Unknown,"the ai agents are here—and they’re taking over more work at the office, reigniting employees' worst fears.","the ai agent be here — and they ’re take over more work at the office , reignite employee ' bad fear .","the ai agent be here — and they ’re take over more work at the office , reignite employee ' bad fear ."
"Elon Musk's xAI plans massive hiring spree of thousands to train Grok, employees say","The company currently employs over 900 tutors and has plans to beef up even more this year, employees told BI.",https://www.businessinsider.com/xai-elon-musk-hiring-ramp-up-data-annotators-2025-2,Unknown,"the company currently employs over 900 tutors and has plans to beef up even more this year, employees told bi.","the company currently employ over 900 tutor and have plan to beef up even more this year , employee tell bi .","the company currently employ over 900 tutor and have plan to beef up even more this year , employee tell bi ."
"How to break into the lucrative field of cybersecurity, according to the pros","Cybersecurity executives told BI that entry-level positions can be scarce, so starting on the ""less glamorous"" side can build valuable experience.",https://www.businessinsider.com/how-to-get-into-cybersecurity-career-job-2025-2,Unknown,"cybersecurity executives told bi that entry-level positions can be scarce, so starting on the ""less glamorous"" side can build valuable experience.","cybersecurity executive tell bi that entry - level position can be scarce , so start on the "" less glamorous "" side can build valuable experience .","cybersecurity executive tell bi that entry - level position can be scarce , so start on the "" less glamorous "" side can build valuable experience ."
The IRS Is Buying an AI Supercomputer From Nvidia,"How exactly the IRS will use the SuperPod AI hardware is unclear. But it comes amid a push for automation in government.
The post The IRS Is Buying an AI Supercomputer From Nvidia appeared first on The Intercept.",https://theintercept.com/2025/02/14/irs-ai-nvidia-tax/,Unknown,"how exactly the irs will use the superpod ai hardware is unclear. but it comes amid a push for automation in government.
the post the irs is buying an ai supercomputer from nvidia appeared first on the intercept.","how exactly the irs will use the superpod ai hardware be unclear . but it come amid a push for automation in government . 
 the post the irs be buy an ai supercomputer from nvidia appear first on the intercept .","how exactly the irs will use the superpod ai hardware be unclear . but it come amid a push for automation in government . 
 the post the irs be buy an ai supercomputer from nvidia appear first on the intercept ."
Employment Is Changing Forever,A conversation with entrepreneur and author Deborah Perry Piscione on the new world of work.,https://hbr.org/podcast/2025/01/employment-is-changing-forever,Unknown,a conversation with entrepreneur and author deborah perry piscione on the new world of work.,a conversation with entrepreneur and author deborah perry piscione on the new world of work .,a conversation with entrepreneur and author deborah perry piscione on the new world of work .
"Firms in Trump's Stargate venture have touted DEI programs, clashing with new order","President Trump has announced a major AI initiative called ""Stargate"" -- but the firms involved have DEI policies that go against his goal of eliminating such programs.",https://abcnews.go.com/US/tech-firms-trumps-ai-stargate-venture-touted-dei/story?id=117996988,Unknown,"president trump has announced a major ai initiative called ""stargate"" -- but the firms involved have dei policies that go against his goal of eliminating such programs.","president trump have announce a major ai initiative call "" stargate "" -- but the firm involve have dei policy that go against his goal of eliminate such program .","president trump have announce a major ai initiative call "" stargate "" -- but the firm involve have dei policy that go against his goal of eliminate such program ."
Revolutionizing Business With AI And Automation: Key To Future Success,Businesses will maintain an edge in the digital market if they see AI and automation as opportunities for improvement rather than dangers to established practices.,https://www.forbes.com/councils/forbesfinancecouncil/2025/01/28/revolutionizing-business-with-ai-and-automation-key-to-future-success/,Unknown,businesses will maintain an edge in the digital market if they see ai and automation as opportunities for improvement rather than dangers to established practices.,business will maintain an edge in the digital market if they see ai and automation as opportunity for improvement rather than danger to establish practice .,business will maintain an edge in the digital market if they see ai and automation as opportunity for improvement rather than danger to establish practice .
Survey: 37% Of Managers Would Rather Hire AI Than Offer Jobs To Gen Z,"According to an international business survey, about 40% of managers would rather hire artificial intelligence robots instead of Gen Z graduates. Here's why.",https://www.forbes.com/sites/chriswestfall/2025/01/28/survey-37-of-managers-would-rather-hire-ai-than-offer-jobs-to-gen-z/,Unknown,"according to an international business survey, about 40% of managers would rather hire artificial intelligence robots instead of gen z graduates. here's why.","accord to an international business survey , about 40 % of manager would rather hire artificial intelligence robot instead of gen z graduate . here be why .","accord to an international business survey , about 40 % of manager would rather hire artificial intelligence robot instead of gen z graduate . here be why ."
Top 5 Emerging Jobs Shaping The Future Of Work,"Technology is transforming the job market, creating high-demand roles in AI, automation, cybersecurity and renewable energy, shaping the future of work and innovation.",https://www.forbes.com/sites/cherylrobinson/2025/02/15/top-5-emerging-jobs-shaping-the-future-of-work/,Unknown,"technology is transforming the job market, creating high-demand roles in ai, automation, cybersecurity and renewable energy, shaping the future of work and innovation.","technology be transform the job market , create high - demand role in ai , automation , cybersecurity and renewable energy , shape the future of work and innovation .","technology be transform the job market , create high - demand role in ai , automation , cybersecurity and renewable energy , shape the future of work and innovation ."
Incorporating AI Agents Into Your Workforce: 5 Future Of Work Ideas,AI agents are redefining the future of work. AGI (artificial general intelligence) is coming. Are you prepared to welcome new capabilities? Here are five ways to prepare.,https://www.forbes.com/sites/chriswestfall/2025/01/23/incorporating-ai-agents-into-your-workforce-5-future-of-work-ideas/,Unknown,ai agents are redefining the future of work. agi (artificial general intelligence) is coming. are you prepared to welcome new capabilities? here are five ways to prepare.,ai agent be redefine the future of work . agi ( artificial general intelligence ) be come . be you prepared to welcome new capability ? here be five way to prepare .,ai agent be redefine the future of work . agi ( artificial general intelligence ) be come . be you prepared to welcome new capability ? here be five way to prepare .
The Essential Skills That Will Define Success In The AI Era (And They're Not What You Think),"As artificial intelligence reshapes the workforce, mastering certain skills has become non-negotiable for career success - but they might surprise you.",https://www.forbes.com/sites/bernardmarr/2025/01/24/the-essential-skills-that-will-define-success-in-the-ai-era-and-theyre-not-what-you-think/,Unknown,"as artificial intelligence reshapes the workforce, mastering certain skills has become non-negotiable for career success - but they might surprise you.","as artificial intelligence reshape the workforce , master certain skill have become non - negotiable for career success - but they might surprise you .","as artificial intelligence reshape the workforce , master certain skill have become non - negotiable for career success - but they might surprise you ."
AI’s Next Move Is Adoption To Business Transformation,The rapid rise of artificial intelligence (AI) has been accompanied by a wealth of promises and predictions.,https://www.forbes.com/sites/garydrenik/2025/02/06/ais-next-move-is-adoption-to-business-transformation/,Unknown,the rapid rise of artificial intelligence (ai) has been accompanied by a wealth of promises and predictions.,the rapid rise of artificial intelligence ( ai ) have be accompany by a wealth of promise and prediction .,the rapid rise of artificial intelligence ( ai ) have be accompany by a wealth of promise and prediction .
Meta set to notify workers impacted by its performance-based cuts,Meta is starting to notify workers impacted by its performance-based job cuts. BI spoke to employees leading up to the cuts.,https://www.businessinsider.com/meta-notifying-workers-impacted-performance-based-cuts-2025-2,Unknown,meta is starting to notify workers impacted by its performance-based job cuts. bi spoke to employees leading up to the cuts.,meta be start to notify worker impact by its performance - base job cut . bi speak to employee lead up to the cut .,meta be start to notify worker impact by its performance - base job cut . bi speak to employee lead up to the cut .
Upskilling The Global Workforce For AI,Today's workforce is struggling to keep up with the pace of innovation. Now is the time to start planning and skilling the workforce for tomorrow's technology.,https://www.forbes.com/councils/forbestechcouncil/2025/01/22/upskilling-the-global-workforce-for-ai/,Unknown,today's workforce is struggling to keep up with the pace of innovation. now is the time to start planning and skilling the workforce for tomorrow's technology.,today 's workforce be struggle to keep up with the pace of innovation . now be the time to start plan and skille the workforce for tomorrow 's technology .,today 's workforce be struggle to keep up with the pace of innovation . now be the time to start plan and skille the workforce for tomorrow 's technology .
Surviving Within Artificial Intelligence's Useless Class,"In a coming age of AI-driven unemployment in which the emergence of a large ""useless class"" is predicted, how will we cope with the possibility of our own redundancy?",https://www.psychologytoday.com/intl/blog/word-less/202502/surviving-within-artificial-intelligences-useless-class,Unknown,"in a coming age of ai-driven unemployment in which the emergence of a large ""useless class"" is predicted, how will we cope with the possibility of our own redundancy?","in a come age of ai - drive unemployment in which the emergence of a large "" useless class "" be predict , how will we cope with the possibility of our own redundancy ?","in a come age of ai - drive unemployment in which the emergence of a large "" useless class "" be predict , how will we cope with the possibility of our own redundancy ?"
"AI Agents Aren’t Taking Jobs, They’re Remaking Them",Agentic AI has been the flavor of the month among some of the biggest companies in the world and has dominated predictions for the New Year.,https://www.forbes.com/sites/garydrenik/2025/02/04/ai-agents-arent-taking-jobs-theyre-remaking-them/,Unknown,agentic ai has been the flavor of the month among some of the biggest companies in the world and has dominated predictions for the new year.,agentic ai have be the flavor of the month among some of the big company in the world and have dominate prediction for the new year .,agentic ai have be the flavor of the month among some of the big company in the world and have dominate prediction for the new year .
Transforming Diagnostics Through Strategic AI And Automation,What I think is most exciting is how AI and automation promise to position us to better care for our staff and patients.,https://www.forbes.com/councils/forbesbusinesscouncil/2025/01/24/transforming-diagnostics-through-strategic-ai-and-automation/,Unknown,what i think is most exciting is how ai and automation promise to position us to better care for our staff and patients.,what I think be most exciting be how ai and automation promise to position we to well care for our staff and patient .,what I think be most exciting be how ai and automation promise to position we to well care for our staff and patient .
Students cheating with generative AI reflects a revenue-driven post-secondary sector,"The higher education sector continues to grapple with the advent of generative artificial intelligence (genAI), with much of the concern focused on ethical issues around student misconduct.",https://phys.org/news/2025-02-students-generative-ai-revenue-driven.html,Unknown,"the higher education sector continues to grapple with the advent of generative artificial intelligence (genai), with much of the concern focused on ethical issues around student misconduct.","the high education sector continue to grapple with the advent of generative artificial intelligence ( genai ) , with much of the concern focus on ethical issue around student misconduct .","the high education sector continue to grapple with the advent of generative artificial intelligence ( genai ) , with much of the concern focus on ethical issue around student misconduct ."
Best Jobs For Growth In The Next 5 Years: Winners And Losers,"New report from World Economic Forum shows winners and losers for job growth through 2030. Here's what you need to know, to prepare your career for the future of work.",https://www.forbes.com/sites/chriswestfall/2025/02/03/best-jobs-for-growth-in-the-next-5-years-winners-and-losers/,Unknown,"new report from world economic forum shows winners and losers for job growth through 2030. here's what you need to know, to prepare your career for the future of work.","new report from world economic forum show winner and loser for job growth through 2030 . here be what you need to know , to prepare your career for the future of work .","new report from world economic forum show winner and loser for job growth through 2030 . here be what you need to know , to prepare your career for the future of work ."
A.I. Buzzwords: Top Artificial Intelligence Changes Reshaping Business,"Discover AI's future in 2025! See how ChatGPT, agentic AI, and digital transformation are reshaping business and work.",https://www.forbes.com/sites/forbes-engineering/2025/02/03/ai-buzzwords-top-artificial-intelligence-changes-reshaping-business/,Unknown,"discover ai's future in 2025! see how chatgpt, agentic ai, and digital transformation are reshaping business and work.","discover ai 's future in 2025 ! see how chatgpt , agentic ai , and digital transformation be reshape business and work .","discover ai 's future in 2025 ! see how chatgpt , agentic ai , and digital transformation be reshape business and work ."
"AI Reset: Layoffs, RTO, And The New Realities Of Work","AI is no longer just a tool—it’s replacing jobs. As Meta and other companies accelerate layoffs and use RTO as a quiet workforce reduction strategy, the future of work is being rewritten.",https://www.forbes.com/sites/jasonsnyder/2025/02/12/ai-reset-layoffs-rto-and-the-new-realities-of-work/,Unknown,"ai is no longer just a tool—it’s replacing jobs. as meta and other companies accelerate layoffs and use rto as a quiet workforce reduction strategy, the future of work is being rewritten.","ai be no long just a tool — it ’s replace job . as meta and other company accelerate layoff and use rto as a quiet workforce reduction strategy , the future of work be be rewrite .","ai be no long just a tool — it ’s replace job . as meta and other company accelerate layoff and use rto as a quiet workforce reduction strategy , the future of work be be rewrite ."
These are Sam Altman's predictions on how the world might change with AI,"OpenAI CEO Sam Altman has made several predictions about where we're headed on AGI, superintelligence, agentic AI — and when we might get there.",https://www.businessinsider.com/openai-sam-altman-predictions-how-ai-could-change-the-world-2025-1,Unknown,"openai ceo sam altman has made several predictions about where we're headed on agi, superintelligence, agentic ai — and when we might get there.","openai ceo sam altman have make several prediction about where we be head on agi , superintelligence , agentic ai — and when we might get there .","openai ceo sam altman have make several prediction about where we be head on agi , superintelligence , agentic ai — and when we might get there ."
How To Help College-Bound Students Build AI Literacy,"As automation replaces routine tasks, colleges are racing to ensure students graduate with the AI literacy needed to thrive.",https://www.forbes.com/sites/avivalegatt/2025/02/08/how-to-help-college-bound-students-build-ai-literacy/,Unknown,"as automation replaces routine tasks, colleges are racing to ensure students graduate with the ai literacy needed to thrive.","as automation replace routine task , college be race to ensure student graduate with the ai literacy need to thrive .","as automation replace routine task , college be race to ensure student graduate with the ai literacy need to thrive ."
