Title,Description,URL,Label,Processed_Description,Stemmed,Lemmatized
International universities give graduates an edge,"KUALA LUMPUR: Students should choose an international university that specialises in future-ready education to ensure they graduate with the skills and knowledge needed to thrive in an evolving global landscape, say education services experts. Read full story",https://www.thestar.com.my/news/nation/2025/02/16/international-universities-give-graduates-an-edge,Unknown,"kuala lumpur: students should choose an international university that specialises in future-ready education to ensure they graduate with the skills and knowledge needed to thrive in an evolving global landscape, say education services experts. read full story","kuala lumpur : student should choose an international university that specialise in future - ready education to ensure they graduate with the skill and knowledge need to thrive in an evolve global landscape , say education service expert . read full story","kuala lumpur : student should choose an international university that specialise in future - ready education to ensure they graduate with the skill and knowledge need to thrive in an evolve global landscape , say education service expert . read full story"
Growing Malaysia’sAI talent pool,"WHILE Malaysia strives to embed artificial intelligence (AI) into its economy and industries, there simply isn’t enough AI talent available. Read full story",https://www.thestar.com.my/news/education/2025/02/16/growing-malaysiasai-talent-pool,Unknown,"while malaysia strives to embed artificial intelligence (ai) into its economy and industries, there simply isn’t enough ai talent available. read full story","while malaysia strive to embed artificial intelligence ( ai ) into its economy and industry , there simply be n’t enough ai talent available . read full story","while malaysia strive to embed artificial intelligence ( ai ) into its economy and industry , there simply be n’t enough ai talent available . read full story"
Only 9% of Japanese people have used generative AI: survey,"While 61 percent of Japanese people are aware of generative artificial intelligence, only 9 percent have used it, according to a survey, highlighting the challenges Japan faces in adopting the new technology while addressing public concern and hesitation. The…",https://japantoday.com/category/tech/only-9-of-japanese-people-have-used-generative-ai-survey,Unknown,"while 61 percent of japanese people are aware of generative artificial intelligence, only 9 percent have used it, according to a survey, highlighting the challenges japan faces in adopting the new technology while addressing public concern and hesitation. the…","while 61 percent of japanese people be aware of generative artificial intelligence , only 9 percent have use it , accord to a survey , highlight the challenge japan face in adopt the new technology while address public concern and hesitation . the …","while 61 percent of japanese people be aware of generative artificial intelligence , only 9 percent have use it , accord to a survey , highlight the challenge japan face in adopt the new technology while address public concern and hesitation . the …"
"As Meta and tech giants trim jobs, will 2025 witness growth in employment? Here’s what experts say","Meta eliminated 3,000 positions, while Workday reduced its workforce by 1,750 employees.",https://economictimes.indiatimes.com/news/international/us/as-meta-and-tech-giants-trim-jobs-will-2025-witness-growth-in-employment-heres-what-experts-say/articleshow/118281110.cms,Unknown,"meta eliminated 3,000 positions, while workday reduced its workforce by 1,750 employees.","meta eliminate 3,000 position , while workday reduce its workforce by 1,750 employee .","meta eliminate 3,000 position , while workday reduce its workforce by 1,750 employee ."
The Rise Of The Hybrid Workforce: Humans And AI Working Together,"We are moving from the hybrid workplace, with the flexibility to work where and when you want, to the hybrid workforce, where humans and AI agents work together.",https://www.forbes.com/sites/jeannemeister/2025/02/15/the-rise-of-the-hybrid-workforce-humans-and-ai-working-together/,Unknown,"we are moving from the hybrid workplace, with the flexibility to work where and when you want, to the hybrid workforce, where humans and ai agents work together.","we be move from the hybrid workplace , with the flexibility to work where and when you want , to the hybrid workforce , where human and ai agent work together .","we be move from the hybrid workplace , with the flexibility to work where and when you want , to the hybrid workforce , where human and ai agent work together ."
Links 2/15/2025,"Our tantilizing daily e-mail: curcumin antibiotic? China food worries? Sikh disputes, Sudan deals w/ Russia and India, Vance slames EU values, more hostage releases, attack on Chernobyl, suit v. Musk power initial win, CFPB shutdown halted, White House freeze…",https://www.nakedcapitalism.com/2025/02/links-2-15-2025.html,Unknown,"our tantilizing daily e-mail: curcumin antibiotic? china food worries? sikh disputes, sudan deals w/ russia and india, vance slames eu values, more hostage releases, attack on chernobyl, suit v. musk power initial win, cfpb shutdown halted, white house freeze…","our tantilize daily e - mail : curcumin antibiotic ? china food worry ? sikh dispute , sudan deal w/ russia and india , vance slam eu value , more hostage release , attack on chernobyl , suit v. musk power initial win , cfpb shutdown halt , white house freeze …","our tantilize daily e - mail : curcumin antibiotic ? china food worry ? sikh dispute , sudan deal w/ russia and india , vance slam eu value , more hostage release , attack on chernobyl , suit v. musk power initial win , cfpb shutdown halt , white house freeze …"
Dave Vellante’s Breaking Analysis: The complete collection,"Breaking Analysis is a weekly editorial program combining knowledge from SiliconANGLE’s theCUBE with spending data from Enterprise Technology Research. Branded as theCUBE Insights, Powered by ETR, the program is our opportunity to share independent, unfiltere…",https://siliconangle.com/2025/02/15/dave-vellantes-breaking-analysis-complete-collection/,Unknown,"breaking analysis is a weekly editorial program combining knowledge from siliconangle’s thecube with spending data from enterprise technology research. branded as thecube insights, powered by etr, the program is our opportunity to share independent, unfiltere…","break analysis be a weekly editorial program combine knowledge from siliconangle ’s   thecube   with spend datum from   enterprise technology research . brand as   thecube insight , power by etr , the program be our opportunity to share independent , unfiltere …","break analysis be a weekly editorial program combine knowledge from siliconangle ’s   thecube   with spend datum from   enterprise technology research . brand as   thecube insight , power by etr , the program be our opportunity to share independent , unfiltere …"
"Malaysia's economy strong, gov't committed to people’s well-being, says Ahmad Zahid","KUALA LUMPUR: Malaysia's economy is on a solid footing and the MADANI Government remains committed to driving sustainable and competitive economic growth to ensure the well-being of the people, particularly in rural areas, says Datuk Seri Dr Ahmad Zahid Hamid…",https://www.thestar.com.my/news/nation/2025/02/15/malaysia039s-economy-strong-gov039t-committed-to-peoples-well-being-says-ahmad-zahid,Unknown,"kuala lumpur: malaysia's economy is on a solid footing and the madani government remains committed to driving sustainable and competitive economic growth to ensure the well-being of the people, particularly in rural areas, says datuk seri dr ahmad zahid hamid…","kuala lumpur : malaysia 's economy be on a solid footing and the madani government remain committed to drive sustainable and competitive economic growth to ensure the well - being of the people , particularly in rural area , say datuk seri dr ahmad zahid hamid …","kuala lumpur : malaysia 's economy be on a solid footing and the madani government remain committed to drive sustainable and competitive economic growth to ensure the well - being of the people , particularly in rural area , say datuk seri dr ahmad zahid hamid …"
Top 5 Emerging Jobs Shaping The Future Of Work,"Technology is transforming the job market, creating high-demand roles in AI, automation, cybersecurity and renewable energy, shaping the future of work and innovation.",https://www.forbes.com/sites/cherylrobinson/2025/02/15/top-5-emerging-jobs-shaping-the-future-of-work/,Unknown,"technology is transforming the job market, creating high-demand roles in ai, automation, cybersecurity and renewable energy, shaping the future of work and innovation.","technology be transform the job market , create high - demand role in ai , automation , cybersecurity and renewable energy , shape the future of work and innovation .","technology be transform the job market , create high - demand role in ai , automation , cybersecurity and renewable energy , shape the future of work and innovation ."
India - U.S. Joint Statement during the visit of Prime Minister of India to US,"The President of the United States of America, The Honorable Donald J. Trump hosted the Prime Minister of India, Shri Narendra Modi for an Official Working Visit in Washington, DC on February 13, 2025.",https://www.globalsecurity.org/wmd/library/news/india/2025/india-250214-india-pib05.htm,Unknown,"the president of the united states of america, the honorable donald j. trump hosted the prime minister of india, shri narendra modi for an official working visit in washington, dc on february 13, 2025.","the president of the united states of america , the honorable donald j. trump host the prime minister of india , shri narendra modi for an official working visit in washington , dc on february 13 , 2025 .","the president of the united states of america , the honorable donald j. trump host the prime minister of india , shri narendra modi for an official working visit in washington , dc on february 13 , 2025 ."
Are China’s AI advancements a double-edged sword hanging over already dire job prospects?,"With China’s youth-unemployment rate an ever-present threat for young jobseekers, now many may have to adapt to an environment awash with AI automation.",https://www.scmp.com/economy/china-economy/article/3298721/are-chinas-ai-advancements-double-edged-sword-hanging-over-already-dire-job-prospects,Unknown,"with china’s youth-unemployment rate an ever-present threat for young jobseekers, now many may have to adapt to an environment awash with ai automation.","with china ’s youth - unemployment rate an ever - present threat for young jobseeker , now many may have to adapt to an environment awash with ai automation .","with china ’s youth - unemployment rate an ever - present threat for young jobseeker , now many may have to adapt to an environment awash with ai automation ."
Is AI already shaking up labor market?,"Four trends point to major change, say researchers David Deming and Lawrence Summers, who studied a century of tech disruptions.",https://news.harvard.edu/gazette/story/2025/02/is-ai-already-shaking-up-labor-market-a-i-artificial-intelligence/,Unknown,"four trends point to major change, say researchers david deming and lawrence summers, who studied a century of tech disruptions.","four trend point to major change , say researcher david deming and lawrence summer , who study a century of tech disruption .","four trend point to major change , say researcher david deming and lawrence summer , who study a century of tech disruption ."
The Real Problem With DOGE’s AI Plans,"Unlike an army of human bureaucrats, an army of AI agents could, almost on a whim, be redirected.",https://www.theatlantic.com/newsletters/archive/2025/02/the-real-problem-with-doges-ai-plans/681706/,Unknown,"unlike an army of human bureaucrats, an army of ai agents could, almost on a whim, be redirected.","unlike an army of human bureaucrat , an army of ai agent could , almost on a whim , be redirect .","unlike an army of human bureaucrat , an army of ai agent could , almost on a whim , be redirect ."
Pentagon officials are bracing for Musk's DOGE,"SecDef hints at pushback, but others worry about the team's record of breaking into databases and making hasty cuts.",https://www.defenseone.com/policy/2025/02/pentagon-officials-are-bracing-musks-doge/403037/,Unknown,"secdef hints at pushback, but others worry about the team's record of breaking into databases and making hasty cuts.","secdef hint at pushback , but other worry about the team 's record of break into database and make hasty cut .","secdef hint at pushback , but other worry about the team 's record of break into database and make hasty cut ."
Tajikistan Faces Challenges in Its Pursuit of AI Dreams,Tajikistan’s minister of industry and innovation has made a bold prediction that the Central Asian nation is going to become a global leader of artificial intelligence (AI) and microchip development. He clearly must have been wearing a virtual reality headset…,https://oilprice.com/Geopolitics/International/Tajikistan-Faces-Challenges-in-Its-Pursuit-of-AI-Dreams.html,Unknown,tajikistan’s minister of industry and innovation has made a bold prediction that the central asian nation is going to become a global leader of artificial intelligence (ai) and microchip development. he clearly must have been wearing a virtual reality headset…,tajikistan ’s minister of industry and innovation have make a bold prediction that the central asian nation be go to become a global leader of artificial intelligence ( ai ) and microchip development . he clearly must have be wear a virtual reality headset …,tajikistan ’s minister of industry and innovation have make a bold prediction that the central asian nation be go to become a global leader of artificial intelligence ( ai ) and microchip development . he clearly must have be wear a virtual reality headset …
AI Tools Are Saving a Consulting Firm's Leaders Six Hours per Week Each,"""We sometimes say that email is the biggest problem hiding in plain sight,"" a tech CEO told Newsweek, explaining how AI can help workplaces be more productive.",https://www.newsweek.com/artificial-intelligence-ai-superhuman-time-saving-email-tools-2030122,Unknown,"""we sometimes say that email is the biggest problem hiding in plain sight,"" a tech ceo told newsweek, explaining how ai can help workplaces be more productive.",""" we sometimes say that email be the big problem hide in plain sight , "" a tech ceo tell newsweek , explain how ai can help workplace be more productive .",""" we sometimes say that email be the big problem hide in plain sight , "" a tech ceo tell newsweek , explain how ai can help workplace be more productive ."
6 Ways To Reinvent Retail With AI,"Amplify brand visibility That consumers expect smarter, more personalized shopping is nothing new.",https://www.forbes.com/sites/jillstandish/2025/02/14/6-ways-to-reinvent-retail-with-ai/,Unknown,"amplify brand visibility that consumers expect smarter, more personalized shopping is nothing new.","amplify brand visibility that consumer expect smart , more personalized shopping be nothing new .","amplify brand visibility that consumer expect smart , more personalized shopping be nothing new ."
"‘AI may become judge, jury and executioner’ – global risks expert to RT","Artificial intelligence is being weaponized across all facets of life, and Google’s recent change of principles is a sign of things to come Read Full Article at RT.com",https://www.rt.com/news/612575-ai-may-become-judge/,Unknown,"artificial intelligence is being weaponized across all facets of life, and google’s recent change of principles is a sign of things to come read full article at rt.com","artificial intelligence be be weaponize across all facet of life , and google ’s recent change of principle be a sign of thing to come read full article at rt.com","artificial intelligence be be weaponize across all facet of life , and google ’s recent change of principle be a sign of thing to come read full article at rt.com"
The IRS Is Buying an AI Supercomputer From Nvidia,"How exactly the IRS will use the SuperPod AI hardware is unclear. But it comes amid a push for automation in government.
The post The IRS Is Buying an AI Supercomputer From Nvidia appeared first on The Intercept.",https://theintercept.com/2025/02/14/irs-ai-nvidia-tax/,Unknown,"how exactly the irs will use the superpod ai hardware is unclear. but it comes amid a push for automation in government.
the post the irs is buying an ai supercomputer from nvidia appeared first on the intercept.","how exactly the irs will use the superpod ai hardware be unclear . but it come amid a push for automation in government . 
 the post the irs be buy an ai supercomputer from nvidia appear first on the intercept .","how exactly the irs will use the superpod ai hardware be unclear . but it come amid a push for automation in government . 
 the post the irs be buy an ai supercomputer from nvidia appear first on the intercept ."
"After Mark Zuckerberg's Meta, now Blue Origin cuts 10% of workforce; Jeff Bezos’ rocket company slashes jobs as it streamlines its space mission",Blue Origin will cut 10% of its workforce to boost rocket production and efficiency. Blue Origin CEO Dave Limp said the company aimed to scale up operations and speed up launches this year.  The company plans to shift from research to a commercially oriented …,https://economictimes.indiatimes.com/news/international/us/after-mark-zuckerbergs-meta-now-blue-origin-cuts-10-of-workforce-jeff-bezos-rocket-company-slashes-jobs-as-it-streamlines-its-space-mission/articleshow/118255681.cms,Unknown,blue origin will cut 10% of its workforce to boost rocket production and efficiency. blue origin ceo dave limp said the company aimed to scale up operations and speed up launches this year.  the company plans to shift from research to a commercially oriented …,blue origin will cut 10 % of its workforce to boost rocket production and efficiency . blue origin ceo dave limp say the company aim to scale up operation and speed up launch this year .   the company plan to shift from research to a commercially orient …,blue origin will cut 10 % of its workforce to boost rocket production and efficiency . blue origin ceo dave limp say the company aim to scale up operation and speed up launch this year .   the company plan to shift from research to a commercially orient …
The Love Affair Between Tech Bros and MAGA Is Already Starting to Turn Ugly,The racist posts from Musk’s DOGE staffer show a widening gap in the GOP between its base and its wealthy technocratic elite.,https://slate.com/technology/2025/02/elon-musk-doge-staffer-racist-x-posts-anti-indian-american-racism.html,Unknown,the racist posts from musk’s doge staffer show a widening gap in the gop between its base and its wealthy technocratic elite.,the racist post from musk ’s doge staffer show a widen gap in the gop between its base and its wealthy technocratic elite .,the racist post from musk ’s doge staffer show a widen gap in the gop between its base and its wealthy technocratic elite .
"Zuckerberg’s rightward policy shift puts Meta staffers on edge, targets Apple","Key Points * Mark Zuckerberg’s open effort to curry favor with President Donald Trump has rattled employees, and the company is censoring their criticism internally, according to people familiar with the matter. * While Zuckerberg is trying to improve his rel…",https://freerepublic.com/focus/f-chat/4297611/posts,Unknown,"key points * mark zuckerberg’s open effort to curry favor with president donald trump has rattled employees, and the company is censoring their criticism internally, according to people familiar with the matter. * while zuckerberg is trying to improve his rel…","key point * mark zuckerberg ’s open effort to curry favor with president donald trump have rattle employee , and the company be censor their criticism internally , accord to people familiar with the matter . * while zuckerberg be try to improve his rel …","key point * mark zuckerberg ’s open effort to curry favor with president donald trump have rattle employee , and the company be censor their criticism internally , accord to people familiar with the matter . * while zuckerberg be try to improve his rel …"
A five-step plan for securing generative AI at government agencies,Here's how to do it right.,https://www.nextgov.com/ideas/2025/02/five-step-plan-securing-generative-ai-government-agencies/403023/,Unknown,here's how to do it right.,here be how to do it right .,here be how to do it right .
77% of CFOs plan to increase tech spending in 2025 as cost pressures reshape budgets,"A majority of CFOs are prioritising technology investments in 2025, with 77% planning to increase spending, according to a Gartner survey.",https://www.techmonitor.ai/finance-and-procurement/77-cfos-increase-tech-spending-2025-cost-pressures-reshape-budgets/,Unknown,"a majority of cfos are prioritising technology investments in 2025, with 77% planning to increase spending, according to a gartner survey.","a majority of cfos be prioritise technology investment in 2025 , with 77 % planning to increase spending , accord to a gartner survey .","a majority of cfos be prioritise technology investment in 2025 , with 77 % planning to increase spending , accord to a gartner survey ."
Charting The Path Forward With Critical Skills Training,Learning and development should be a strategic investment in the future of your business.,https://www.forbes.com/councils/forbesbusinesscouncil/2025/02/14/charting-the-path-forward-with-critical-skills-training/,Unknown,learning and development should be a strategic investment in the future of your business.,learning and development should be a strategic investment in the future of your business .,learning and development should be a strategic investment in the future of your business .
"Amazon Robotics chief technologist discusses AI, warehouse jobs, and how human 'common sense' will always be needed","In a wide-ranging interview with BI, Tye Brady explains why the company is investing heavily in robots.",https://www.businessinsider.com/amazon-robotics-tye-brady-ai-warehouse-jobs-human-common-sense-2025-2,Unknown,"in a wide-ranging interview with bi, tye brady explains why the company is investing heavily in robots.","in a wide - range interview with bi , tye brady explain why the company be invest heavily in robot .","in a wide - range interview with bi , tye brady explain why the company be invest heavily in robot ."
The Role Of AI In Upskilling The Workforce And Identifying Disease,"The future of healthcare is defined by this blend of technology and human expertise, offering new hope for a more efficient and equitable healthcare system.",https://www.forbes.com/councils/forbestechcouncil/2025/02/14/the-role-of-ai-in-upskilling-the-workforce-and-identifying-disease/,Unknown,"the future of healthcare is defined by this blend of technology and human expertise, offering new hope for a more efficient and equitable healthcare system.","the future of healthcare be define by this blend of technology and human expertise , offer new hope for a more efficient and equitable healthcare system .","the future of healthcare be define by this blend of technology and human expertise , offer new hope for a more efficient and equitable healthcare system ."
"Zuckerberg's rightward policy shift puts Meta staffers on edge, targets Apple","Meta CEO Mark Zuckerberg's actions to curry favor with the president have rattled employees, but people familiar with his efforts say there's a clear strategy.",https://www.cnbc.com/2025/02/14/zuckerbergs-rightward-policy-shift-hits-meta-staffers-targets-apple.html,Unknown,"meta ceo mark zuckerberg's actions to curry favor with the president have rattled employees, but people familiar with his efforts say there's a clear strategy.","meta ceo mark zuckerberg 's action to curry favor with the president have rattle employee , but people familiar with his effort say there be a clear strategy .","meta ceo mark zuckerberg 's action to curry favor with the president have rattle employee , but people familiar with his effort say there be a clear strategy ."
5 Business Strategies That Can Give Leaders A Competitive Advantage,Successful business owners must adopt practices that streamline operations and maximize their time. Here are five strategies I've found worthy enough to recommend.,https://www.forbes.com/councils/forbesbusinessdevelopmentcouncil/2025/02/14/5-business-strategies-that-can-give-leaders-a-competitive-advantage/,Unknown,successful business owners must adopt practices that streamline operations and maximize their time. here are five strategies i've found worthy enough to recommend.,successful business owner must adopt practice that streamline operation and maximize their time . here be five strategy I have find worthy enough to recommend .,successful business owner must adopt practice that streamline operation and maximize their time . here be five strategy I have find worthy enough to recommend .
