Title,Description,URL,Label,Processed_Description,Stemmed,Lemmatized
Career-Connected Learning Prepares Students For Tomorrow’s Workforce,"Preparing Tomorrow’s Workforce, by Hans Meeder, published by YouScience, explores career-connected learning, career navigation skills, and aptitude-based guidance.",https://www.forbes.com/sites/rayravaglia/2025/02/07/career-connected-learning-prepares-students-for-tomorrows-workforce/,Unknown,"preparing tomorrow’s workforce, by hans meeder, published by youscience, explores career-connected learning, career navigation skills, and aptitude-based guidance.","prepare tomorrow ’s workforce , by hans meeder , publish by youscience , explore career - connect learning , career navigation skill , and aptitude - base guidance .","prepare tomorrow ’s workforce , by hans meeder , publish by youscience , explore career - connect learning , career navigation skill , and aptitude - base guidance ."
AI Puts 70% Of Britain’s ‘Knowledge Economy’ Tasks At Risk,"AI’s capabilities are advancing at “breath-taking speed” and the technology is now poised to have a “seismic impact” on British society, new research predicts.",https://www.forbes.com/sites/robertolsen-1/2025/02/08/ai-puts-70-of-britains-knowledge-economy-tasks-at-risk/,Unknown,"ai’s capabilities are advancing at “breath-taking speed” and the technology is now poised to have a “seismic impact” on british society, new research predicts.","ai ’s capability be advance at "" breath - take speed "" and the technology be now poise to have a "" seismic impact "" on british society , new research predict .","ai ’s capability be advance at "" breath - take speed "" and the technology be now poise to have a "" seismic impact "" on british society , new research predict ."
Anthropic Economic Index – 10 AI Workplace Trends Business Leaders Must Know,The index strongly suggests that AI’s role in the workplace will continue to evolve and expand. Organizations that view AI as a collaborative partner rather than a replacement technology will be best positioned to capture its benefits.,https://www.forbes.com/sites/janakirammsv/2025/02/10/anthropic-economic-index--10-ai-workplace-trends-business-leaders-must-know/,Unknown,the index strongly suggests that ai’s role in the workplace will continue to evolve and expand. organizations that view ai as a collaborative partner rather than a replacement technology will be best positioned to capture its benefits.,the index strongly suggest that ai ’s role in the workplace will continue to evolve and expand . organization that view ai as a collaborative partner rather than a replacement technology will be well position to capture its benefit .,the index strongly suggest that ai ’s role in the workplace will continue to evolve and expand . organization that view ai as a collaborative partner rather than a replacement technology will be well position to capture its benefit .
How AI Is Redefining Career Success According To The World Economic Forum,"According to the World Economic Forum, reskilling and upskilling are critical for building a future-ready workforce.",https://www.forbes.com/sites/avivalegatt/2025/01/21/how-ai-is-redefining-career-success-according-to-the-world-economic-forum/,Unknown,"according to the world economic forum, reskilling and upskilling are critical for building a future-ready workforce.","accord to the world economic forum , reskille and upskilling be critical for build a future - ready workforce .","accord to the world economic forum , reskille and upskilling be critical for build a future - ready workforce ."
AI In Lending - The Hidden Tech Refining Your Bank Experience,"As artificial intelligence (AI) continues to shape industries worldwide, its role in banking has quietly evolved behind the scenes.",https://www.forbes.com/sites/garydrenik/2025/01/30/ai-in-lendingthe-hidden-tech-refining-your-bank-experience/,Unknown,"as artificial intelligence (ai) continues to shape industries worldwide, its role in banking has quietly evolved behind the scenes.","as artificial intelligence ( ai ) continue to shape industry worldwide , its role in banking have quietly evolve behind the scene .","as artificial intelligence ( ai ) continue to shape industry worldwide , its role in banking have quietly evolve behind the scene ."
The State Of AI Cybersecurity In 2025 And Beyond,"AI, which was originally solely used for automation and optimization, now acts as both a shield and a sword in the field of cybersecurity.",https://www.forbes.com/councils/forbestechcouncil/2025/01/21/the-state-of-ai-cybersecurity-in-2025-and-beyond/,Unknown,"ai, which was originally solely used for automation and optimization, now acts as both a shield and a sword in the field of cybersecurity.","ai , which be originally solely use for automation and optimization , now act as both a shield and a sword in the field of cybersecurity .","ai , which be originally solely use for automation and optimization , now act as both a shield and a sword in the field of cybersecurity ."
"A global jobs crisis is looming — and here's how to tackle it, says Singapore's president",Tharman Shanmugaratnam warned of mass joblessness in the years ahead and called for worker education and training to be revamped.,https://www.businessinsider.com/jobs-crisis-singapore-president-davos-wef-unemployment-ai-education-work-2025-1,Unknown,tharman shanmugaratnam warned of mass joblessness in the years ahead and called for worker education and training to be revamped.,tharman shanmugaratnam warn of mass joblessness in the year ahead and call for worker education and training to be revamp .,tharman shanmugaratnam warn of mass joblessness in the year ahead and call for worker education and training to be revamp .
The Future Of Work: AI And Workforce Integration For Scalable Success,"Most of our time has been spent on the tech, and little has been done to prepare individuals, businesses, and policymakers for the rapid integration of AI into job roles.",https://www.forbes.com/sites/solrashidi/2025/01/30/the-future-of-work-ai-and-workforce-integration-for-scalable-success/,Unknown,"most of our time has been spent on the tech, and little has been done to prepare individuals, businesses, and policymakers for the rapid integration of ai into job roles.","most of our time have be spend on the tech , and little have be do to prepare individual , business , and policymaker for the rapid integration of ai into job role .","most of our time have be spend on the tech , and little have be do to prepare individual , business , and policymaker for the rapid integration of ai into job role ."
Fears About AI Job Loss: New Study Answers If They’re Justified,Discover the findings of a new study that analyzes ten top jobs to determine if fears about AI job loss are justified in the coming years.,https://www.forbes.com/sites/bryanrobinson/2025/02/09/fears-about-ai-job-loss-new-study-answers-if-theyre-justified/,Anti-AI,discover the findings of a new study that analyzes ten top jobs to determine if fears about ai job loss are justified in the coming years.,discover the finding of a new study that analyze ten top job to determine if fear about ai job loss be justify in the come year .,discover the finding of a new study that analyze ten top job to determine if fear about ai job loss be justify in the come year .
People Get Ready: The Challenge Of Building An AI-Ready Workforce,If you haven’t made AI a top priority—and with that comes the challenge of making your people as comfortable with AI as they are with texting—there’s no time to lose.,https://www.forbes.com/sites/juliadhar/2025/02/12/people-get-ready-the-challenge-of-building-an-ai-ready-workforce/,Unknown,if you haven’t made ai a top priority—and with that comes the challenge of making your people as comfortable with ai as they are with texting—there’s no time to lose.,if you have n’t make ai a top priority — and with that come the challenge of make your people as comfortable with ai as they be with texting — there ’ no time to lose .,if you have n’t make ai a top priority — and with that come the challenge of make your people as comfortable with ai as they be with texting — there ’ no time to lose .
The Future Of Work: Universities Leading With Competency-Based Education,"In a world where industries can be disrupted overnight, universities play a pivotal role in preparing the workforce of the future.",https://www.forbes.com/sites/majazelihic/2025/01/23/the-future-of-work-universities-leading-with-competency-based-education/,Unknown,"in a world where industries can be disrupted overnight, universities play a pivotal role in preparing the workforce of the future.","in a world where industry can be disrupt overnight , university play a pivotal role in prepare the workforce of the future .","in a world where industry can be disrupt overnight , university play a pivotal role in prepare the workforce of the future ."
"If AI Is So Efficient, Why Is Worker Productivity Such A Problem?","Artificial Intelligence can do a lot of things, but is it truly allowing workers to be more productive in the workplace?",https://www.forbes.com/sites/gregpetro/2025/01/20/if-ai-is-so-efficient-why-is-worker-productivity-such-a-problem/,Unknown,"artificial intelligence can do a lot of things, but is it truly allowing workers to be more productive in the workplace?","artificial intelligence can do a lot of thing , but be it truly allow worker to be more productive in the workplace ?","artificial intelligence can do a lot of thing , but be it truly allow worker to be more productive in the workplace ?"
Paris AI Summit 2025: 5 Critical Themes Shaping Global AI Policy,"The Paris AI Action Summit focuses on five key themes: public-interest AI, the future of work, investment, sustainability and international AI regulation.",https://www.forbes.com/sites/dianaspehar/2025/02/10/paris-ai-summit-2025-5-critical-themes-shaping-global-ai-policy/,Unknown,"the paris ai action summit focuses on five key themes: public-interest ai, the future of work, investment, sustainability and international ai regulation.","the paris ai action summit focus on five key theme : public - interest ai , the future of work , investment , sustainability and international ai regulation .","the paris ai action summit focus on five key theme : public - interest ai , the future of work , investment , sustainability and international ai regulation ."
Dan Golka and Mike Adams: Artificial intelligence is reshaping the workforce,"By 2025, AI is expected to cause mass layoffs across industries, replacing roles in mid-level management, coding, customer service and more, due to its efficiency and cost-effectiveness. Customer service, finance, retail, fast food and creative industries are…",https://www.naturalnews.com/2025-01-16-golka-adams-artificial-intelligence-reshaping-the-workforce.html,Unknown,"by 2025, ai is expected to cause mass layoffs across industries, replacing roles in mid-level management, coding, customer service and more, due to its efficiency and cost-effectiveness. customer service, finance, retail, fast food and creative industries are…","by 2025 , ai be expect to cause mass layoff across industry , replace role in mid - level management , coding , customer service and more , due to its efficiency and cost - effectiveness . customer service , finance , retail , fast food and creative industry be …","by 2025 , ai be expect to cause mass layoff across industry , replace role in mid - level management , coding , customer service and more , due to its efficiency and cost - effectiveness . customer service , finance , retail , fast food and creative industry be …"
"EmployAI Of The Month, Software Copilots In The Workforce","AI is with us at work yes, but has it yet to embarrass itself at the staff party and learned to get the coffee order in for everyone? A dose of realism is needed.",https://www.forbes.com/sites/adrianbridgwater/2025/02/12/employai-of-the-month-software-copilots-in-the-workforce/,Unknown,"ai is with us at work yes, but has it yet to embarrass itself at the staff party and learned to get the coffee order in for everyone? a dose of realism is needed.","ai be with we at work yes , but have it yet to embarrass itself at the staff party and learn to get the coffee order in for everyone ? a dose of realism be need .","ai be with we at work yes , but have it yet to embarrass itself at the staff party and learn to get the coffee order in for everyone ? a dose of realism be need ."
The Future of Work: Jobs Thriving and Declining in the AI Era,"Artificial intelligence (AI), automation, and digital technologies are fundamentally reshaping the global job market at an unprecedented pace. According to the World Economic Forum, these advancements are expected to displace millions of jobs by 2030 while si…",https://www.geeky-gadgets.com/which-jobs-will-be-replaced-first-by-ai/,Unknown,"artificial intelligence (ai), automation, and digital technologies are fundamentally reshaping the global job market at an unprecedented pace. according to the world economic forum, these advancements are expected to displace millions of jobs by 2030 while si…","artificial intelligence ( ai ) , automation , and digital technology be fundamentally reshape the global job market at an unprecedented pace . accord to the world economic forum , these advancement be expect to displace million of job by 2030 while si …","artificial intelligence ( ai ) , automation , and digital technology be fundamentally reshape the global job market at an unprecedented pace . accord to the world economic forum , these advancement be expect to displace million of job by 2030 while si …"
"‘Millennial Careers At Risk Due To AI,’ 38% Say In New Survey","In a new study, 38% of leaders say AI is putting Millennial careers at risk, and if you're Gen Z or other generation, you're close behind unless you practice these tips.",https://www.forbes.com/sites/bryanrobinson/2025/01/19/millennial-careers-at-risk-due-to-ai-38-say-in-new-survey/,Unknown,"in a new study, 38% of leaders say ai is putting millennial careers at risk, and if you're gen z or other generation, you're close behind unless you practice these tips.","in a new study , 38 % of leader say ai be put millennial career at risk , and if you be gen z or other generation , you be close behind unless you practice these tip .","in a new study , 38 % of leader say ai be put millennial career at risk , and if you be gen z or other generation , you be close behind unless you practice these tip ."
Using AI Customer Support Agents To Create Jobs And Expand Industry,"Fears of AI replacing jobs echo past tech revolutions, but innovation often creates more opportunities than it destroys.",https://www.forbes.com/councils/forbesbusinesscouncil/2025/02/06/using-ai-customer-support-agents-to-create-jobs-and-expand-industry/,Unknown,"fears of ai replacing jobs echo past tech revolutions, but innovation often creates more opportunities than it destroys.","fear of ai replace job echo past tech revolution , but innovation often create more opportunity than it destroy .","fear of ai replace job echo past tech revolution , but innovation often create more opportunity than it destroy ."
3 Strategies Preparing The Next Generation For The Future Of Work,An entrepreneurial mindset is valuable in this evolving landscape because it fosters creativity and a proactive approach to problem-solving.,https://www.forbes.com/sites/sarahhernholm/2025/01/28/3-strategies-preparing-the-next-generation-for-the-future-of-work/,Unknown,an entrepreneurial mindset is valuable in this evolving landscape because it fosters creativity and a proactive approach to problem-solving.,an entrepreneurial mindset be valuable in this evolve landscape because it foster creativity and a proactive approach to problem - solving .,an entrepreneurial mindset be valuable in this evolve landscape because it foster creativity and a proactive approach to problem - solving .
AMD stock plunges 10% despite beating sales expectations,"Shares of Advanced Micro Devices (AMD) tumbled more than 10% on Wednesday morning, hitting a new 52-week low despite the semiconductor giant exceeding revenue expectations in its latest earnings report. The shares were trading at $108 each in the morning.Read…",https://qz.com/amd-earnings-report-fourth-quarter-ai-chipmaker-1851755835,Unknown,"shares of advanced micro devices (amd) tumbled more than 10% on wednesday morning, hitting a new 52-week low despite the semiconductor giant exceeding revenue expectations in its latest earnings report. the shares were trading at $108 each in the morning.read…","share of advanced micro devices ( amd ) tumble more than 10 % on wednesday morning , hit a new 52 - week low despite the semiconductor giant exceed revenue expectation in its late earning report . the share be trade at $ 108 each in the morning.read …","share of advanced micro devices ( amd ) tumble more than 10 % on wednesday morning , hit a new 52 - week low despite the semiconductor giant exceed revenue expectation in its late earning report . the share be trade at $ 108 each in the morning.read …"
Forget Billion-Dollar Companies—Will AI Create Billion-Dollar People?,"AI isn’t just changing jobs—it’s changing who controls economic opportunity. In the future of work, AI may replace companies, not people.",https://www.forbes.com/sites/niritcohen/2025/02/02/forget-billion-dollar-companies-will-ai-create-billion-dollar-people/,Unknown,"ai isn’t just changing jobs—it’s changing who controls economic opportunity. in the future of work, ai may replace companies, not people.","ai be not just change job — it ’s change who control economic opportunity . in the future of work , ai may replace company , not people .","ai be not just change job — it ’s change who control economic opportunity . in the future of work , ai may replace company , not people ."
Graduating The New AI-Ready Workforce: How GA Tech Is Leading The Way,"Georgia Tech and NVIDIA’s AI Makerspace is preparing students for the AI-driven workforce through education, hands-on learning, and industry collaboration.",https://www.forbes.com/sites/committeeof200/2025/02/10/graduating-the-new-ai-ready-workforce-how-ga-tech-is-leading-the-way/,Unknown,"georgia tech and nvidia’s ai makerspace is preparing students for the ai-driven workforce through education, hands-on learning, and industry collaboration.","georgia tech and nvidia ’s ai makerspace be prepare student for the ai - drive workforce through education , hand - on learning , and industry collaboration .","georgia tech and nvidia ’s ai makerspace be prepare student for the ai - drive workforce through education , hand - on learning , and industry collaboration ."
Collaborative AI: How Human-AI Teams Can Enhance The Field Service Industry,What if your equipment could predict failures before they happen? AI is making this future a reality for the field service industry.,https://www.forbes.com/councils/forbesbusinesscouncil/2025/02/10/collaborative-ai-how-human-ai-teams-can-enhance-the-field-service-industry/,Unknown,what if your equipment could predict failures before they happen? ai is making this future a reality for the field service industry.,what if your equipment could predict failure before they happen ? ai be make this future a reality for the field service industry .,what if your equipment could predict failure before they happen ? ai be make this future a reality for the field service industry .
Workforce EI Training Can Address The Current ‘Emotional Recession’,"With the right training, employers can ensure that their workforce has the soft skills needed to take on people-focused, empathy-based work.",https://www.forbes.com/councils/forbeshumanresourcescouncil/2025/02/11/workforce-ei-training-can-address-the-current-emotional-recession/,Unknown,"with the right training, employers can ensure that their workforce has the soft skills needed to take on people-focused, empathy-based work.","with the right training , employer can ensure that their workforce have the soft skill need to take on people - focus , empathy - base work .","with the right training , employer can ensure that their workforce have the soft skill need to take on people - focus , empathy - base work ."
The Rise Of The Hybrid Workforce: Humans And AI Working Together,"We are moving from the hybrid workplace, with the flexibility to work where and when you want, to the hybrid workforce, where humans and AI agents work together.",https://www.forbes.com/sites/jeannemeister/2025/02/15/the-rise-of-the-hybrid-workforce-humans-and-ai-working-together/,Unknown,"we are moving from the hybrid workplace, with the flexibility to work where and when you want, to the hybrid workforce, where humans and ai agents work together.","we be move from the hybrid workplace , with the flexibility to work where and when you want , to the hybrid workforce , where human and ai agent work together .","we be move from the hybrid workplace , with the flexibility to work where and when you want , to the hybrid workforce , where human and ai agent work together ."
Why Skills Should Be On The CEO’s Radar,"In this new era, skills are more than just checkboxes on a resume; they are dynamic, nuanced and context-dependent.",https://www.forbes.com/councils/forbesbusinesscouncil/2025/01/28/why-skills-should-be-on-the-ceos-radar/,Unknown,"in this new era, skills are more than just checkboxes on a resume; they are dynamic, nuanced and context-dependent.","in this new era , skill be more than just checkboxe on a resume ; they be dynamic , nuanced and context - dependent .","in this new era , skill be more than just checkboxe on a resume ; they be dynamic , nuanced and context - dependent ."
Cybersecurity jobs are in high demand. Execs in the field explain why.,Cybersecurity executives explain how the threat landscape has evolved — and why it can be challenging to find the right talent.,https://www.businessinsider.com/why-cybersecurity-jobs-high-demand-ai-2025-1,Unknown,cybersecurity executives explain how the threat landscape has evolved — and why it can be challenging to find the right talent.,cybersecurity executive explain how the threat landscape have evolve — and why it can be challenge to find the right talent .,cybersecurity executive explain how the threat landscape have evolve — and why it can be challenge to find the right talent .
2024: A landmark year In The Evolution Of AI,"By the end of the year, over 90% of businesses actively encouraged the use of generative AI, with 29% having already trained more than a quarter of their workforce.",https://www.forbes.com/sites/sylvainduranton/2025/01/27/2024-a-landmark-year-in-the-evolution-of-ai/,Unknown,"by the end of the year, over 90% of businesses actively encouraged the use of generative ai, with 29% having already trained more than a quarter of their workforce.","by the end of the year , over 90 % of business actively encourage the use of generative ai , with 29 % having already train more than a quarter of their workforce .","by the end of the year , over 90 % of business actively encourage the use of generative ai , with 29 % having already train more than a quarter of their workforce ."
How AI Will Really Revolutionize Job Markets: Tech Experts’ Takes,"Tech experts note that while the impact of AI may be inevitable, it’s also likely to come with genuine upsides for workers (and risks for businesses).",https://www.forbes.com/councils/forbestechcouncil/2025/02/03/how-ai-will-really-revolutionize-job-markets-tech-experts-takes/,Unknown,"tech experts note that while the impact of ai may be inevitable, it’s also likely to come with genuine upsides for workers (and risks for businesses).","tech expert note that while the impact of ai may be inevitable , it ’s also likely to come with genuine upside for worker ( and risk for business ) .","tech expert note that while the impact of ai may be inevitable , it ’s also likely to come with genuine upside for worker ( and risk for business ) ."
AI’s role in revolutionizing compliance training,"Organizations must leave tick-box compliance behind and embrace meaningful, modern training strategies that empower the workforce.",https://www.techradar.com/pro/ais-role-in-revolutionizing-compliance-training,Unknown,"organizations must leave tick-box compliance behind and embrace meaningful, modern training strategies that empower the workforce.","organization must leave tick - box compliance behind and embrace meaningful , modern training strategy that empower the workforce .","organization must leave tick - box compliance behind and embrace meaningful , modern training strategy that empower the workforce ."
Why Pods Could Be The Future Of Leadership And Organizational Design,"Podding is a team-based organizational structure in which companies break down their workforce into smaller, cross-functional groups, or ""pods.""",https://www.forbes.com/sites/scotthutcheson/2025/01/21/why-pods-could-be-the-future-of-leadership-and-organizational-design/,Unknown,"podding is a team-based organizational structure in which companies break down their workforce into smaller, cross-functional groups, or ""pods.""","podding be a team - base organizational structure in which company break down their workforce into small , cross - functional group , or "" pod . ""","podding be a team - base organizational structure in which company break down their workforce into small , cross - functional group , or "" pod . """
